title,description
Возможность внести реальный вклад в развитие своего города ,"Платформа предоставляет возможность волонтерам активно участвовать в городских проектах и инициативах, внося свой вклад в улучшение городской среды и услуг"
Содействие социальной справедливости ,"Платформа стремится преодолеть социальные неравенства и помочь тем, кто в большей нужде, будь то малообеспеченные семьи, бездомные люди, дети из трудных семей или другие уязвимые группы "
Возможность развития навыков и получение опыта ,"Волонтеры получают возможность участвовать в различных проектах, расширять свои профессиональные и личностные навыки, а также приобретать ценный опыт работы в команде и решении реальных задач "
Создание сильного и солидарного городского сообщества ,Волонтеры могут почувствовать принадлежность к городскому сообществу и работать с другими единомышленниками для достижения общих целей 
Проявление гражданской ответственности ,"Волонтеры, участвуя в проектах и инициативах, могут стать активными гражданами, проявляющими заботу о своем городе и его жителях "